{
  "$schema": "https://ui.shadcn.com/schema/registry-item.json",
  "name": "use-memory-leak-guard",
  "type": "registry:hook",
  "title": "Use Memory Leak Guard",
  "description": "Detects runaway timers and detached DOM refs in development, warning with helpful stack traces.",
  "files": [
    {
      "path": "registry/hooks/use-memory-leak-guard.ts",
      "content": "import * as React from \"react\"\n\ntype TimerType = \"timeout\" | \"interval\"\n\ntype TimerHandle = unknown\n\ninterface TimerRecord {\n  id: TimerHandle\n  type: TimerType\n  createdAt: number\n  delay: number\n  stack?: string\n  warned?: boolean\n}\n\nconst isDev = process.env.NODE_ENV !== \"production\"\n\nfunction describeHandle(handle: TimerHandle): string {\n  return typeof handle === \"number\" ? `#${handle}` : \"[object Timer]\"\n}\n\nconst timerRegistry: Map<TimerHandle, TimerRecord> =\n  typeof window !== \"undefined\"\n    ? ((window as any).__usekitTimerRegistry ??\n      ((window as any).__usekitTimerRegistry = new Map()))\n    : new Map()\n\nlet timersPatched = false\n\nfunction captureStack(label: string): string | undefined {\n  try {\n    const error = new Error(label)\n    return error.stack\n  } catch {\n    return undefined\n  }\n}\n\nfunction patchTimers() {\n  if (timersPatched || typeof window === \"undefined\") {\n    return\n  }\n\n  const originalSetTimeout = window.setTimeout.bind(window)\n  const originalClearTimeout = window.clearTimeout.bind(window)\n  const originalSetInterval = window.setInterval.bind(window)\n  const originalClearInterval = window.clearInterval.bind(window)\n  const performanceNow =\n    typeof performance !== \"undefined\" && performance.now\n      ? () => performance.now()\n      : () => Date.now()\n\n  const patchedSetTimeout = function setTimeoutPatched(\n    handler: TimerHandler,\n    timeout?: number,\n    ...args: any[]\n  ): ReturnType<typeof originalSetTimeout> {\n    if (typeof handler !== \"function\") {\n      return originalSetTimeout(\n        handler,\n        timeout,\n        ...args\n      ) as unknown as ReturnType<typeof originalSetTimeout>\n    }\n\n    const stack = captureStack(\"Timer created\")\n    let timerKey: TimerHandle | null = null\n    const wrappedHandler = (...cbArgs: any[]) => {\n      if (timerKey) {\n        timerRegistry.delete(timerKey)\n      }\n      handler(...cbArgs)\n    }\n\n    const handle = originalSetTimeout(\n      wrappedHandler,\n      timeout,\n      ...args\n    ) as unknown as ReturnType<typeof originalSetTimeout>\n\n    timerKey = handle as TimerHandle\n\n    const assuredKey = timerKey as TimerHandle\n\n    timerRegistry.set(assuredKey, {\n      id: assuredKey,\n      type: \"timeout\",\n      createdAt: performanceNow(),\n      delay: typeof timeout === \"number\" ? timeout : 0,\n      stack,\n    })\n\n    return handle\n  }\n\n  const patchedClearTimeout = function clearTimeoutPatched(\n    handle: Parameters<typeof window.clearTimeout>[0]\n  ): void {\n    timerRegistry.delete(handle as TimerHandle)\n    originalClearTimeout(handle)\n  }\n\n  const patchedSetInterval = function setIntervalPatched(\n    handler: TimerHandler,\n    timeout?: number,\n    ...args: any[]\n  ): ReturnType<typeof originalSetInterval> {\n    if (typeof handler !== \"function\") {\n      return originalSetInterval(\n        handler,\n        timeout,\n        ...args\n      ) as unknown as ReturnType<typeof originalSetInterval>\n    }\n\n    const stack = captureStack(\"Interval created\")\n    const handle = originalSetInterval(\n      (...cbArgs: any[]) => {\n        handler(...cbArgs)\n      },\n      timeout,\n      ...args\n    ) as unknown as ReturnType<typeof originalSetInterval>\n\n    const timerKey = handle as unknown as TimerHandle\n\n    timerRegistry.set(timerKey, {\n      id: timerKey,\n      type: \"interval\",\n      createdAt: performanceNow(),\n      delay: typeof timeout === \"number\" ? timeout : 0,\n      stack,\n    })\n\n    return handle\n  }\n\n  const patchedClearInterval = function clearIntervalPatched(\n    handle: Parameters<typeof window.clearInterval>[0]\n  ): void {\n    timerRegistry.delete(handle as TimerHandle)\n    originalClearInterval(handle)\n  }\n\n  const wrappedSetTimeout =\n    patchedSetTimeout as unknown as typeof window.setTimeout\n  const wrappedSetInterval =\n    patchedSetInterval as unknown as typeof window.setInterval\n  const wrappedClearTimeout =\n    patchedClearTimeout as unknown as typeof window.clearTimeout\n  const wrappedClearInterval =\n    patchedClearInterval as unknown as typeof window.clearInterval\n\n  if ((originalSetTimeout as any).__promisify__) {\n    ;(wrappedSetTimeout as any).__promisify__ = (\n      originalSetTimeout as any\n    ).__promisify__\n  }\n  if ((originalSetInterval as any).__promisify__) {\n    ;(wrappedSetInterval as any).__promisify__ = (\n      originalSetInterval as any\n    ).__promisify__\n  }\n\n  window.setTimeout = wrappedSetTimeout\n  window.clearTimeout = wrappedClearTimeout\n  window.setInterval = wrappedSetInterval\n  window.clearInterval = wrappedClearInterval\n\n  timersPatched = true\n}\n\nexport interface UseMemoryLeakGuardOptions {\n  refs?: Array<React.RefObject<Element | null>>\n  timerThresholdMs?: number\n  domCheckIntervalMs?: number\n  flushOnUnload?: boolean\n}\n\nexport function useMemoryLeakGuard(\n  options: UseMemoryLeakGuardOptions = {}\n): void {\n  const {\n    refs = [],\n    timerThresholdMs = 60000,\n    domCheckIntervalMs = 3000,\n    flushOnUnload = false,\n  } = options\n\n  React.useEffect(() => {\n    if (!isDev || typeof window === \"undefined\") return\n    patchTimers()\n\n    const now =\n      typeof performance !== \"undefined\" && performance.now\n        ? () => performance.now()\n        : () => Date.now()\n\n    const checkTimers = () => {\n      const current = now()\n      timerRegistry.forEach((record) => {\n        if (record.warned) return\n\n        const elapsed = current - record.createdAt\n\n        if (\n          record.type === \"interval\" &&\n          elapsed > timerThresholdMs &&\n          record.delay > 0\n        ) {\n          record.warned = true\n          console.warn(\n            `[useMemoryLeakGuard] Interval (id: ${describeHandle(\n              record.id\n            )}) has been running for ${Math.round(\n              elapsed\n            )}ms without being cleared. Created with delay ${\n              record.delay\n            }ms.\\n\\n${record.stack ?? \"\"}`\n          )\n        }\n\n        if (\n          record.type === \"timeout\" &&\n          record.delay > timerThresholdMs &&\n          elapsed > timerThresholdMs\n        ) {\n          record.warned = true\n          console.warn(\n            `[useMemoryLeakGuard] Timeout (id: ${describeHandle(\n              record.id\n            )}) scheduled for ${\n              record.delay\n            }ms may indicate a leak. Consider clearing it on unmount.\\n\\n${\n              record.stack ?? \"\"\n            }`\n          )\n        }\n      })\n    }\n\n    checkTimers()\n    const timerId = window.setInterval(\n      checkTimers,\n      Math.min(timerThresholdMs, 10000)\n    )\n\n    return () => {\n      window.clearInterval(timerId)\n    }\n  }, [timerThresholdMs])\n\n  React.useEffect(() => {\n    if (!isDev || typeof window === \"undefined\" || refs.length === 0) return\n\n    const warnedNodes = new WeakSet<Element>()\n    const contains = (node: Element) =>\n      document.body.contains(node) || node === document.body\n\n    const checkNodes = () => {\n      refs.forEach((ref) => {\n        const node = ref?.current\n        if (node && !contains(node) && !warnedNodes.has(node)) {\n          warnedNodes.add(node)\n          const stack = captureStack(\"Detached ref detected\")\n          console.warn(\n            \"[useMemoryLeakGuard] A ref still points to a DOM node that is no longer in the document. Make sure to null the ref when removing the element.\\n\\n\",\n            node,\n            \"\\n\",\n            stack ?? \"\"\n          )\n        }\n      })\n    }\n\n    checkNodes()\n    const intervalId = window.setInterval(checkNodes, domCheckIntervalMs)\n    return () => window.clearInterval(intervalId)\n  }, [refs, domCheckIntervalMs])\n\n  React.useEffect(() => {\n    if (\n      !flushOnUnload ||\n      !isDev ||\n      typeof window === \"undefined\" ||\n      !timersPatched\n    )\n      return\n\n    const handleBeforeUnload = () => {\n      timerRegistry.forEach((record) => {\n        if (record.type === \"interval\" && !record.warned) {\n          record.warned = true\n          console.warn(\n            `[useMemoryLeakGuard] Interval (id: ${describeHandle(\n              record.id\n            )}) was still active during unload. Clear intervals in component cleanup to avoid leaks.\\n\\n${\n              record.stack ?? \"\"\n            }`\n          )\n        }\n      })\n    }\n\n    window.addEventListener(\"beforeunload\", handleBeforeUnload)\n    return () => window.removeEventListener(\"beforeunload\", handleBeforeUnload)\n  }, [flushOnUnload])\n}\n",
      "type": "registry:hook"
    }
  ]
}
