{
  "$schema": "https://ui.shadcn.com/schema/registry-item.json",
  "name": "use-document-title",
  "type": "registry:hook",
  "title": "Use Document Title",
  "description": "Dynamically update the document title. Pass a string, and the document title updates whenever the value changes.",
  "files": [
    {
      "path": "registry/use-document-title/use-document-title.tsx",
      "content": "\"use client\"\n\nimport * as React from \"react\"\n\nexport function useDocumentTitle(title: string) {\n  React.useEffect(() => {\n    document.title = title\n  }, [title])\n}\n",
      "type": "registry:hook"
    }
  ]
}