{
  "$schema": "https://ui.shadcn.com/schema/registry-item.json",
  "name": "use-breadcrumbs",
  "type": "registry:hook",
  "title": "Use Breadcrumbs",
  "description": "Manage breadcrumb navigation rules with push/pop/replace operations, auto-generation from URL, and customizable labels.",
  "files": [
    {
      "path": "registry/hooks/use-breadcrumbs.ts",
      "content": "import * as React from \"react\"\n\nexport interface BreadcrumbItem {\n  label: string\n  href: string\n}\n\nexport interface UseBreadcrumbsOptions {\n  items?: BreadcrumbItem[]\n  generateLabel?: (segment: string, index: number, segments: string[]) => string\n  autoGenerate?: boolean\n  basePath?: string\n  maxDepth?: number\n  navigate?: (href: string) => void\n  getPathname?: () => string\n}\n\nexport interface UseBreadcrumbsReturn {\n  items: BreadcrumbItem[]\n  push: (item: BreadcrumbItem) => void\n  pop: () => void\n  replace: (item: BreadcrumbItem) => void\n  setItems: (items: BreadcrumbItem[]) => void\n  reset: () => void\n  navigate: (href: string) => void\n}\n\nfunction defaultGenerateLabel(segment: string): string {\n  return segment\n    .split(\"-\")\n    .map((word) => word.charAt(0).toUpperCase() + word.slice(1))\n    .join(\" \")\n}\n\nfunction generateBreadcrumbsFromPath(\n  pathname: string,\n  generateLabel: (segment: string, index: number, segments: string[]) => string,\n  basePath?: string,\n  maxDepth?: number\n): BreadcrumbItem[] {\n  let path = pathname\n\n  if (basePath && path.startsWith(basePath)) {\n    path = path.slice(basePath.length) || \"/\"\n  }\n\n  const segments = path.split(\"/\").filter(Boolean)\n  const depth = Math.min(segments.length, maxDepth ?? 10)\n\n  const items: BreadcrumbItem[] = [\n    {\n      label: \"Home\",\n      href: basePath || \"/\",\n    },\n  ]\n\n  let currentPath = basePath || \"\"\n\n  for (let i = 0; i < depth; i++) {\n    const segment = segments[i]!\n    currentPath = `${currentPath}/${segment}`\n    items.push({\n      label: generateLabel(segment, i, segments),\n      href: currentPath,\n    })\n  }\n\n  return items\n}\n\nfunction getCurrentPathname(getPathname?: () => string): string {\n  if (typeof window === \"undefined\") return \"/\"\n  if (getPathname) return getPathname()\n  return window.location.pathname\n}\n\nexport function useBreadcrumbs(\n  options: UseBreadcrumbsOptions = {}\n): UseBreadcrumbsReturn {\n  const {\n    items: initialItems,\n    generateLabel = defaultGenerateLabel,\n    autoGenerate = true,\n    basePath,\n    maxDepth = 10,\n    navigate: customNavigate,\n    getPathname,\n  } = options\n\n  const [pathname, setPathname] = React.useState(() =>\n    getCurrentPathname(getPathname)\n  )\n\n  const [items, setItemsState] = React.useState<BreadcrumbItem[]>(() => {\n    if (initialItems) {\n      return initialItems\n    }\n    if (autoGenerate) {\n      return generateBreadcrumbsFromPath(\n        pathname,\n        generateLabel,\n        basePath,\n        maxDepth\n      )\n    }\n    return []\n  })\n\n  const initialItemsRef = React.useRef(initialItems)\n  const pathnameRef = React.useRef(pathname)\n\n  React.useEffect(() => {\n    if (typeof window === \"undefined\") return\n\n    const updatePathname = () => {\n      const current = getCurrentPathname(getPathname)\n      if (current !== pathnameRef.current) {\n        pathnameRef.current = current\n        setPathname(current)\n\n        if (autoGenerate) {\n          const generated = generateBreadcrumbsFromPath(\n            current,\n            generateLabel,\n            basePath,\n            maxDepth\n          )\n          setItemsState(generated)\n        }\n      }\n    }\n\n    updatePathname()\n\n    const handlePopState = () => {\n      updatePathname()\n    }\n\n    window.addEventListener(\"popstate\", handlePopState)\n\n    const interval = setInterval(updatePathname, 100)\n\n    return () => {\n      window.removeEventListener(\"popstate\", handlePopState)\n      clearInterval(interval)\n    }\n  }, [autoGenerate, generateLabel, basePath, maxDepth, getPathname])\n\n  const push = React.useCallback((item: BreadcrumbItem) => {\n    setItemsState((prev) => [...prev, item])\n  }, [])\n\n  const pop = React.useCallback(() => {\n    setItemsState((prev) => {\n      if (prev.length <= 1) return prev\n      return prev.slice(0, -1)\n    })\n  }, [])\n\n  const replace = React.useCallback((item: BreadcrumbItem) => {\n    setItemsState((prev) => {\n      if (prev.length === 0) return [item]\n      return [...prev.slice(0, -1), item]\n    })\n  }, [])\n\n  const setItems = React.useCallback((newItems: BreadcrumbItem[]) => {\n    setItemsState(newItems)\n  }, [])\n\n  const reset = React.useCallback(() => {\n    if (initialItemsRef.current) {\n      setItemsState(initialItemsRef.current)\n    } else if (autoGenerate) {\n      const current = getCurrentPathname(getPathname)\n      const generated = generateBreadcrumbsFromPath(\n        current,\n        generateLabel,\n        basePath,\n        maxDepth\n      )\n      setItemsState(generated)\n    } else {\n      setItemsState([])\n    }\n  }, [autoGenerate, generateLabel, basePath, maxDepth, getPathname])\n\n  const navigate = React.useCallback(\n    (href: string) => {\n      if (customNavigate) {\n        customNavigate(href)\n      } else if (typeof window !== \"undefined\") {\n        window.location.href = href\n      }\n    },\n    [customNavigate]\n  )\n\n  return {\n    items,\n    push,\n    pop,\n    replace,\n    setItems,\n    reset,\n    navigate,\n  }\n}\n",
      "type": "registry:hook"
    }
  ]
}
