{
  "$schema": "https://ui.shadcn.com/schema/registry-item.json",
  "name": "use-toggle",
  "type": "registry:hook",
  "title": "Use Toggle",
  "description": "Easily manage a boolean state with useToggle.",
  "files": [
    {
      "path": "registry/use-toggle/use-toggle.tsx",
      "content": "\"use client\"\n\nimport * as React from \"react\"\n\nexport function useToggle(\n  defaultValue?: boolean\n): [boolean, () => void, React.Dispatch<React.SetStateAction<boolean>>] {\n  const [value, setValue] = React.useState(!!defaultValue)\n\n  const toggle = React.useCallback(() => {\n    setValue((x) => !x)\n  }, [])\n\n  return [value, toggle, setValue]\n}\n",
      "type": "registry:hook"
    }
  ]
}