{
  "$schema": "https://ui.shadcn.com/schema/registry-item.json",
  "name": "use-dark-mode-schedule",
  "type": "registry:hook",
  "title": "Use Dark Mode Schedule",
  "description": "Automatically switches themes based on schedules with custom start/end times, system-preference fallback, and smooth transitions.",
  "files": [
    {
      "path": "registry/hooks/use-dark-mode-schedule.ts",
      "content": "import * as React from \"react\"\n\nexport interface UseDarkModeScheduleOptions {\n  darkStartTime?: string\n  darkEndTime?: string\n  fallbackToSystem?: boolean\n  smoothTransition?: boolean\n  setTheme?: (theme: \"light\" | \"dark\" | \"system\") => void\n  checkInterval?: number\n}\n\nexport interface UseDarkModeScheduleReturn {\n  currentTheme: \"light\" | \"dark\" | \"system\"\n  isDarkMode: boolean\n  isScheduleActive: boolean\n  timeUntilSwitch: number | null\n  setTheme: (theme: \"light\" | \"dark\" | \"system\") => void\n  reset: () => void\n}\n\nfunction parseTime(timeStr: string): number {\n  const [hours, minutes] = timeStr.split(\":\").map(Number)\n  return hours * 60 + minutes\n}\n\nfunction getCurrentTimeInMinutes(): number {\n  const now = new Date()\n  return now.getHours() * 60 + now.getMinutes()\n}\n\nfunction isTimeInRange(current: number, start: number, end: number): boolean {\n  if (start < end) {\n    return current >= start && current < end\n  }\n  return current >= start || current < end\n}\n\nfunction getTimeUntilNextSwitch(\n  current: number,\n  start: number,\n  end: number\n): number {\n  const isDark = isTimeInRange(current, start, end)\n\n  if (isDark && start > end) {\n    const untilEnd = end + 24 * 60 - current\n    return untilEnd * 60 * 1000\n  }\n\n  if (!isDark && start < end) {\n    const untilStart = start - current\n    return untilStart * 60 * 1000\n  }\n\n  if (!isDark && start > end) {\n    const untilStart = start - current\n    return untilStart * 60 * 1000\n  }\n\n  const untilEnd = end - current\n  return untilEnd * 60 * 1000\n}\n\nfunction getSystemPreference(): \"light\" | \"dark\" {\n  if (typeof window === \"undefined\") return \"light\"\n  return window.matchMedia(\"(prefers-color-scheme: dark)\").matches\n    ? \"dark\"\n    : \"light\"\n}\n\nexport function useDarkModeSchedule(\n  options: UseDarkModeScheduleOptions = {}\n): UseDarkModeScheduleReturn {\n  const {\n    darkStartTime = \"18:00\",\n    darkEndTime = \"06:00\",\n    fallbackToSystem = true,\n    smoothTransition = false,\n    setTheme: customSetTheme,\n    checkInterval = 60000,\n  } = options\n\n  const [manualOverride, setManualOverride] = React.useState<\n    \"light\" | \"dark\" | \"system\" | null\n  >(null)\n  const [systemPref, setSystemPref] = React.useState<\"light\" | \"dark\">(\n    getSystemPreference\n  )\n\n  const darkStartMinutes = React.useMemo(\n    () => parseTime(darkStartTime),\n    [darkStartTime]\n  )\n  const darkEndMinutes = React.useMemo(\n    () => parseTime(darkEndTime),\n    [darkEndTime]\n  )\n\n  const [currentTime, setCurrentTime] = React.useState(() =>\n    getCurrentTimeInMinutes()\n  )\n\n  React.useEffect(() => {\n    const updateTime = () => {\n      setCurrentTime(getCurrentTimeInMinutes())\n    }\n\n    const interval = setInterval(updateTime, checkInterval)\n    return () => clearInterval(interval)\n  }, [checkInterval])\n\n  React.useEffect(() => {\n    if (typeof window === \"undefined\") return\n\n    const mediaQuery = window.matchMedia(\"(prefers-color-scheme: dark)\")\n    const handleChange = (e: MediaQueryListEvent) => {\n      setSystemPref(e.matches ? \"dark\" : \"light\")\n    }\n\n    mediaQuery.addEventListener(\"change\", handleChange)\n    return () => mediaQuery.removeEventListener(\"change\", handleChange)\n  }, [])\n\n  const isScheduleActive = React.useMemo(\n    () => isTimeInRange(currentTime, darkStartMinutes, darkEndMinutes),\n    [currentTime, darkStartMinutes, darkEndMinutes]\n  )\n\n  const effectiveTheme = React.useMemo((): \"light\" | \"dark\" | \"system\" => {\n    if (manualOverride !== null) {\n      if (manualOverride === \"system\") {\n        return fallbackToSystem ? \"system\" : \"light\"\n      }\n      return manualOverride\n    }\n\n    if (isScheduleActive) {\n      return \"dark\"\n    }\n\n    if (fallbackToSystem) {\n      return \"system\"\n    }\n\n    return \"light\"\n  }, [manualOverride, isScheduleActive, fallbackToSystem])\n\n  const timeUntilSwitch = React.useMemo(() => {\n    if (manualOverride !== null) return null\n    return getTimeUntilNextSwitch(currentTime, darkStartMinutes, darkEndMinutes)\n  }, [currentTime, darkStartMinutes, darkEndMinutes, manualOverride])\n\n  const applyTheme = React.useCallback(\n    (theme: \"light\" | \"dark\" | \"system\") => {\n      const actualTheme =\n        theme === \"system\" && fallbackToSystem\n          ? systemPref\n          : theme === \"system\"\n            ? \"light\"\n            : theme\n\n      if (customSetTheme) {\n        if (theme === \"system\" && fallbackToSystem) {\n          customSetTheme(\"system\")\n        } else {\n          customSetTheme(actualTheme)\n        }\n        return\n      }\n\n      if (typeof window === \"undefined\") return\n\n      const root = document.documentElement\n\n      if (smoothTransition) {\n        root.style.transition = \"background-color 0.3s ease, color 0.3s ease\"\n      } else {\n        root.style.transition = \"\"\n      }\n\n      if (actualTheme === \"dark\") {\n        root.classList.add(\"dark\")\n        root.classList.remove(\"light\")\n      } else {\n        root.classList.add(\"light\")\n        root.classList.remove(\"dark\")\n      }\n    },\n    [customSetTheme, smoothTransition, fallbackToSystem, systemPref]\n  )\n\n  React.useEffect(() => {\n    if (manualOverride === null) {\n      applyTheme(effectiveTheme)\n    }\n  }, [effectiveTheme, manualOverride, applyTheme])\n\n  const setTheme = React.useCallback(\n    (theme: \"light\" | \"dark\" | \"system\") => {\n      setManualOverride(theme)\n      applyTheme(theme)\n    },\n    [applyTheme]\n  )\n\n  const reset = React.useCallback(() => {\n    setManualOverride(null)\n  }, [])\n\n  const isDarkMode = React.useMemo(() => {\n    if (effectiveTheme === \"dark\") return true\n    if (effectiveTheme === \"system\" && fallbackToSystem) {\n      return systemPref === \"dark\"\n    }\n    return false\n  }, [effectiveTheme, fallbackToSystem, systemPref])\n\n  return {\n    currentTheme: effectiveTheme,\n    isDarkMode,\n    isScheduleActive,\n    timeUntilSwitch,\n    setTheme,\n    reset,\n  }\n}\n",
      "type": "registry:hook"
    }
  ]
}
