{
  "$schema": "https://ui.uselab.com/schema/registry-item.json",
  "name": "use-dock-manager",
  "type": "registry:hook",
  "title": "Use Dock Manager",
  "description": "Manage dockable panels with positions (left, right, bottom, floating) and handle panel docking/undocking operations.",
  "files": [
    {
      "path": "registry/hooks/use-dock-manager.ts",
      "content": "\"use client\"\n\nimport * as React from \"react\"\n\nexport type DockPosition = \"left\" | \"right\" | \"bottom\" | \"floating\"\n\nexport interface PanelState {\n  id: string\n  position: DockPosition\n  floatingPosition?: {\n    x: number\n    y: number\n    width?: number\n    height?: number\n  }\n  zIndex?: number\n  order?: number\n}\n\nexport interface UseDockManagerOptions {\n  defaultPosition?: DockPosition\n  persistState?: boolean\n  storageKey?: string\n}\n\nexport interface UseDockManagerReturn {\n  panels: Map<string, PanelState>\n  dock: (\n    panelId: string,\n    position: DockPosition,\n    options?: { floatingPosition?: PanelState[\"floatingPosition\"] }\n  ) => void\n  undock: (panelId: string) => void\n  getPanel: (panelId: string) => PanelState | undefined\n  updatePanel: (panelId: string, updates: Partial<PanelState>) => void\n  clear: () => void\n}\n\nconst defaultZIndex = 1000\nlet globalZIndex = defaultZIndex\n\nconst panelStore = new Map<string, PanelState>()\nconst listeners = new Set<() => void>()\n\nfunction subscribe(listener: () => void) {\n  listeners.add(listener)\n  return () => {\n    listeners.delete(listener)\n  }\n}\n\nfunction notify() {\n  listeners.forEach((listener) => listener())\n}\n\nfunction loadFromStorage(key: string): Map<string, PanelState> {\n  if (typeof window === \"undefined\") return new Map()\n\n  try {\n    const stored = localStorage.getItem(key)\n    if (!stored) return new Map()\n\n    const data = JSON.parse(stored)\n    const map = new Map<string, PanelState>()\n    Object.entries(data).forEach(([id, state]) => {\n      map.set(id, state as PanelState)\n    })\n    return map\n  } catch {\n    return new Map()\n  }\n}\n\nfunction saveToStorage(key: string, panels: Map<string, PanelState>) {\n  if (typeof window === \"undefined\") return\n\n  try {\n    const data = Object.fromEntries(panels)\n    localStorage.setItem(key, JSON.stringify(data))\n  } catch {\n    // Ignore storage errors\n  }\n}\n\nexport function useDockManager(\n  options: UseDockManagerOptions = {}\n): UseDockManagerReturn {\n  const {\n    defaultPosition = \"right\",\n    persistState = false,\n    storageKey = \"dock-manager-state\",\n  } = options\n\n  const [panels, setPanels] = React.useState<Map<string, PanelState>>(() => {\n    if (persistState) {\n      const stored = loadFromStorage(storageKey)\n      if (stored.size > 0) {\n        panelStore.clear()\n        stored.forEach((state, id) => {\n          panelStore.set(id, state)\n        })\n        return stored\n      }\n    }\n    return new Map(panelStore)\n  })\n\n  React.useEffect(() => {\n    const unsubscribe = subscribe(() => {\n      setPanels(new Map(panelStore))\n    })\n    return unsubscribe\n  }, [])\n\n  React.useEffect(() => {\n    if (persistState) {\n      saveToStorage(storageKey, panels)\n    }\n  }, [panels, persistState, storageKey])\n\n  const dock = React.useCallback(\n    (\n      panelId: string,\n      position: DockPosition,\n      options?: { floatingPosition?: PanelState[\"floatingPosition\"] }\n    ) => {\n      const existingPanel = panelStore.get(panelId)\n      const floatingPosition =\n        options?.floatingPosition ??\n        (existingPanel?.position === \"floating\"\n          ? existingPanel.floatingPosition\n          : undefined)\n\n      const order =\n        position === \"floating\"\n          ? undefined\n          : Array.from(panelStore.values()).filter(\n              (p) => p.position === position\n            ).length\n\n      const panelState: PanelState = {\n        id: panelId,\n        position,\n        floatingPosition,\n        zIndex: position === \"floating\" ? ++globalZIndex : undefined,\n        order,\n      }\n\n      panelStore.set(panelId, panelState)\n      notify()\n    },\n    []\n  )\n\n  const undock = React.useCallback((panelId: string) => {\n    panelStore.delete(panelId)\n    notify()\n  }, [])\n\n  const getPanel = React.useCallback((panelId: string) => {\n    return panelStore.get(panelId)\n  }, [])\n\n  const updatePanel = React.useCallback(\n    (panelId: string, updates: Partial<PanelState>) => {\n      const existing = panelStore.get(panelId)\n      if (!existing) return\n\n      const updated: PanelState = {\n        ...existing,\n        ...updates,\n        id: panelId,\n      }\n\n      if (updates.position === \"floating\" && !updated.zIndex) {\n        updated.zIndex = ++globalZIndex\n      }\n\n      if (updates.position && updates.position !== \"floating\") {\n        updated.zIndex = undefined\n        updated.order =\n          Array.from(panelStore.values()).filter(\n            (p) => p.position === updates.position && p.id !== panelId\n          ).length + 1\n      }\n\n      panelStore.set(panelId, updated)\n      notify()\n    },\n    []\n  )\n\n  const clear = React.useCallback(() => {\n    panelStore.clear()\n    if (persistState && typeof window !== \"undefined\") {\n      localStorage.removeItem(storageKey)\n    }\n    notify()\n  }, [persistState, storageKey])\n\n  return {\n    panels,\n    dock,\n    undock,\n    getPanel,\n    updatePanel,\n    clear,\n  }\n}\n",
      "type": "registry:hook"
    }
  ]
}
