{
  "$schema": "https://ui.shadcn.com/schema/registry-item.json",
  "name": "use-progressive-upload",
  "type": "registry:hook",
  "title": "Use Progressive Upload",
  "description": "Chunked upload that adapts chunk size on poor networks and resumes on reconnect for large file uploads on flaky mobile networks.",
  "files": [
    {
      "path": "registry/hooks/use-progressive-upload.ts",
      "content": "import * as React from \"react\"\n\nexport interface UseProgressiveUploadOptions {\n  endpoint: string\n  onProgress?: (progress: number) => void\n  chunkSize?: number\n  minChunkSize?: number\n  maxChunkSize?: number\n  maxRetries?: number\n  retryDelay?: number\n  storageKey?: string\n  persistState?: boolean\n}\n\nexport interface UseProgressiveUploadReturn {\n  start: () => Promise<void>\n  pause: () => void\n  resume: () => void\n  progress: number\n  isUploading: boolean\n  isPaused: boolean\n  error: Error | null\n}\n\ninterface UploadState {\n  fileId: string\n  totalChunks: number\n  uploadedChunks: number[]\n  chunkSize: number\n  lastChunkIndex: number\n}\n\nconst DEFAULT_CHUNK_SIZE = 256 * 1024 // 256KB\nconst MIN_CHUNK_SIZE = 64 * 1024 // 64KB\nconst MAX_CHUNK_SIZE = 2 * 1024 * 1024 // 2MB\nconst DEFAULT_MAX_RETRIES = 3\nconst DEFAULT_RETRY_DELAY = 1000\nconst DEFAULT_STORAGE_KEY = \"usekit:upload-state\"\n\nfunction generateFileId(file: File): string {\n  return `${file.name}-${file.size}-${file.lastModified}`\n}\n\nfunction getStoredState(\n  fileId: string,\n  storageKey: string\n): UploadState | null {\n  if (typeof window === \"undefined\") return null\n\n  try {\n    const stored = window.localStorage.getItem(storageKey)\n    if (!stored) return null\n\n    const state = JSON.parse(stored) as UploadState\n    if (state.fileId === fileId) {\n      return state\n    }\n  } catch {}\n\n  return null\n}\n\nfunction saveState(\n  state: UploadState,\n  storageKey: string,\n  persist: boolean\n): void {\n  if (!persist || typeof window === \"undefined\") return\n\n  try {\n    window.localStorage.setItem(storageKey, JSON.stringify(state))\n  } catch {}\n}\n\nfunction clearState(storageKey: string): void {\n  if (typeof window === \"undefined\") return\n\n  try {\n    window.localStorage.removeItem(storageKey)\n  } catch {}\n}\n\nexport function useProgressiveUpload(\n  file: File | null,\n  options: UseProgressiveUploadOptions\n): UseProgressiveUploadReturn {\n  const {\n    endpoint,\n    onProgress,\n    chunkSize: initialChunkSize = DEFAULT_CHUNK_SIZE,\n    minChunkSize = MIN_CHUNK_SIZE,\n    maxChunkSize = MAX_CHUNK_SIZE,\n    maxRetries = DEFAULT_MAX_RETRIES,\n    retryDelay = DEFAULT_RETRY_DELAY,\n    storageKey = DEFAULT_STORAGE_KEY,\n    persistState = true,\n  } = options\n\n  const [progress, setProgress] = React.useState(0)\n  const [isUploading, setIsUploading] = React.useState(false)\n  const [isPaused, setIsPaused] = React.useState(false)\n  const [error, setError] = React.useState<Error | null>(null)\n\n  const abortControllerRef = React.useRef<AbortController | null>(null)\n  const currentChunkSizeRef = React.useRef(initialChunkSize)\n  const uploadStateRef = React.useRef<UploadState | null>(null)\n  const isPausedRef = React.useRef(false)\n  const performanceMetricsRef = React.useRef<{\n    successful: number\n    failed: number\n    totalTime: number\n    totalBytes: number\n  }>({\n    successful: 0,\n    failed: 0,\n    totalTime: 0,\n    totalBytes: 0,\n  })\n\n  const adaptChunkSize = React.useCallback(\n    (metrics: typeof performanceMetricsRef.current) => {\n      const { successful, failed, totalTime, totalBytes } = metrics\n\n      if (successful === 0) return\n\n      const failureRate = failed / (successful + failed)\n      const avgSpeed = totalBytes / Math.max(totalTime, 1)\n\n      // Decrease chunk size on high failure rate or slow speed\n      if (failureRate > 0.3 || avgSpeed < 50 * 1024) {\n        currentChunkSizeRef.current = Math.max(\n          minChunkSize,\n          Math.floor(currentChunkSizeRef.current * 0.75)\n        )\n      }\n      // Increase chunk size on good performance\n      else if (failureRate < 0.1 && avgSpeed > 200 * 1024) {\n        currentChunkSizeRef.current = Math.min(\n          maxChunkSize,\n          Math.floor(currentChunkSizeRef.current * 1.25)\n        )\n      }\n    },\n    [minChunkSize, maxChunkSize]\n  )\n\n  const uploadChunk = React.useCallback(\n    async (\n      chunk: Blob,\n      chunkIndex: number,\n      totalChunks: number,\n      fileId: string\n    ): Promise<void> => {\n      const startTime = performance.now()\n      const formData = new FormData()\n      formData.append(\"chunk\", chunk)\n      formData.append(\"chunkIndex\", chunkIndex.toString())\n      formData.append(\"totalChunks\", totalChunks.toString())\n      formData.append(\"fileId\", fileId)\n      formData.append(\"fileName\", file?.name || \"\")\n      formData.append(\"fileSize\", file?.size.toString() || \"0\")\n\n      let lastError: Error | null = null\n\n      for (let attempt = 0; attempt <= maxRetries; attempt++) {\n        if (abortControllerRef.current?.signal.aborted) {\n          throw new Error(\"Upload aborted\")\n        }\n\n        if (isPausedRef.current) {\n          throw new Error(\"Upload paused\")\n        }\n\n        try {\n          const response = await fetch(endpoint, {\n            method: \"POST\",\n            body: formData,\n            signal: abortControllerRef.current?.signal,\n          })\n\n          if (!response.ok) {\n            throw new Error(`HTTP error! Status: ${response.status}`)\n          }\n\n          const elapsed = performance.now() - startTime\n          performanceMetricsRef.current.successful++\n          performanceMetricsRef.current.totalTime += elapsed\n          performanceMetricsRef.current.totalBytes += chunk.size\n\n          adaptChunkSize(performanceMetricsRef.current)\n\n          return\n        } catch (err) {\n          lastError = err instanceof Error ? err : new Error(String(err))\n\n          if (\n            attempt < maxRetries &&\n            !abortControllerRef.current?.signal.aborted\n          ) {\n            await new Promise((resolve) =>\n              setTimeout(resolve, retryDelay * (attempt + 1))\n            )\n          }\n        }\n      }\n\n      performanceMetricsRef.current.failed++\n      throw lastError || new Error(\"Upload failed after retries\")\n    },\n    [endpoint, file, maxRetries, retryDelay, adaptChunkSize]\n  )\n\n  const start = React.useCallback(async () => {\n    if (!file) {\n      setError(new Error(\"No file provided\"))\n      return\n    }\n\n    setError(null)\n    setIsUploading(true)\n    setIsPaused(false)\n    isPausedRef.current = false\n\n    abortControllerRef.current = new AbortController()\n    const fileId = generateFileId(file)\n\n    let state = getStoredState(fileId, storageKey)\n    if (!state) {\n      const totalChunks = Math.ceil(file.size / currentChunkSizeRef.current)\n      state = {\n        fileId,\n        totalChunks,\n        uploadedChunks: [],\n        chunkSize: currentChunkSizeRef.current,\n        lastChunkIndex: 0,\n      }\n    } else {\n      currentChunkSizeRef.current = state.chunkSize\n    }\n\n    uploadStateRef.current = state\n\n    try {\n      const uploadedSet = new Set(state.uploadedChunks)\n      let uploadedBytes = 0\n\n      for (const chunkIndex of state.uploadedChunks) {\n        const chunkStart = chunkIndex * state.chunkSize\n        const chunkEnd = Math.min(chunkStart + state.chunkSize, file.size)\n        uploadedBytes += chunkEnd - chunkStart\n      }\n\n      for (\n        let chunkIndex = state.lastChunkIndex;\n        chunkIndex < state.totalChunks;\n        chunkIndex++\n      ) {\n        if (abortControllerRef.current?.signal.aborted || isPausedRef.current) {\n          break\n        }\n\n        if (uploadedSet.has(chunkIndex)) {\n          continue\n        }\n\n        const chunkStart = chunkIndex * currentChunkSizeRef.current\n        const chunkEnd = Math.min(\n          chunkStart + currentChunkSizeRef.current,\n          file.size\n        )\n        const chunk = file.slice(chunkStart, chunkEnd)\n\n        await uploadChunk(chunk, chunkIndex, state.totalChunks, fileId)\n\n        uploadedBytes += chunkEnd - chunkStart\n        uploadedSet.add(chunkIndex)\n\n        state.uploadedChunks = Array.from(uploadedSet)\n        state.lastChunkIndex = chunkIndex + 1\n        state.chunkSize = currentChunkSizeRef.current\n\n        saveState(state, storageKey, persistState)\n\n        const newProgress = Math.min(100, (uploadedBytes / file.size) * 100)\n        setProgress(newProgress)\n        onProgress?.(newProgress)\n\n        await new Promise((resolve) => setTimeout(resolve, 50))\n      }\n\n      if (uploadedSet.size === state.totalChunks) {\n        clearState(storageKey)\n        setProgress(100)\n        onProgress?.(100)\n      }\n    } catch (err) {\n      const uploadError = err instanceof Error ? err : new Error(String(err))\n\n      if (uploadError.message !== \"Upload paused\") {\n        setError(uploadError)\n      }\n    } finally {\n      setIsUploading(false)\n    }\n  }, [file, onProgress, storageKey, persistState, uploadChunk])\n\n  const pause = React.useCallback(() => {\n    isPausedRef.current = true\n    setIsPaused(true)\n    abortControllerRef.current?.abort()\n  }, [])\n\n  const resume = React.useCallback(() => {\n    isPausedRef.current = false\n    setIsPaused(false)\n    if (file) {\n      start()\n    }\n  }, [file, start])\n\n  React.useEffect(() => {\n    return () => {\n      abortControllerRef.current?.abort()\n    }\n  }, [])\n\n  return {\n    start,\n    pause,\n    resume,\n    progress,\n    isUploading,\n    isPaused,\n    error,\n  }\n}\n",
      "type": "registry:hook"
    }
  ]
}
